{
  "$schema": "urn:kingdom:schema:rare-pathway-challenge:1",
  "protocol": "kingdom.rare-pathway-challenge/0.1",
  "challenge_id": "vanishing-path-2026-08-13",
  "title": "The Vanishing Path",
  "compiled_on": "2026-08-13",
  "evidence_through": "2024-06-20",
  "origin": {
    "kind": "conversation-challenge",
    "credit": "A family challenge to turn the disappearing-polymorph story into useful mathematics.",
    "personal_identifiers_recorded": false,
    "participation": "voluntary"
  },
  "binding": {
    "case_id": "ritonavir-disappearing-polymorph-2026-08-11",
    "url": "https://thekingdom.dev/polymorphs/ritonavir-disappearing-polymorph-2026-08-11.json",
    "raw_digest": "sha256:08148603a1228960ac35df1378f1283c3fce43874a9fc07e6687f18e980dcb1c",
    "semantic_digest": "sha256:6c759f595f0c6753dcf47d25d2a3490246984ef2b79adf31a558261b26ef8116",
    "relation": "illustrative-history-not-rate-fit",
    "mutated": false,
    "authority_imported": false
  },
  "scope": {
    "phenomenon": "A pathway may remain possible while becoming rarely accessible or unobserved within a bounded process, population, horizon, and detection rule.",
    "purpose": "Practise competing-risk inference, distinguish non-observation from impossibility, and design a more informative next question.",
    "intended_use": "Education, model criticism, reproducible calculation, and bounded experiment-design reasoning.",
    "excluded_use": "No ritonavir rate estimate, material recipe, wet-lab procedure, manufacturing control, medical decision, or judgment of a person's motive or worth.",
    "registers": [
      "MATHEMATICAL_DERIVATION",
      "EMPIRICAL_QUESTION",
      "DESIGN_PROPOSAL",
      "OPT_IN_REFLECTION"
    ]
  },
  "states": [
    {
      "id": "possible",
      "plain_language": "The model permits the path.",
      "does_not_imply": "The path is reachable under the current conditions."
    },
    {
      "id": "accessible",
      "plain_language": "The current condition and history give the path a nonzero arrival hazard.",
      "does_not_imply": "The path will occur within the observation horizon."
    },
    {
      "id": "occurred",
      "plain_language": "The event happened in the bounded system.",
      "does_not_imply": "The event was observed or correctly classified."
    },
    {
      "id": "detected",
      "plain_language": "The event crossed a declared observation and classification rule.",
      "does_not_imply": "The detector saw every event or established literal extinction when it saw none."
    }
  ],
  "models": [
    {
      "id": "time-dependent-competing-hazards",
      "register": "MATHEMATICAL_DERIVATION",
      "equations": [
        "S(t)=exp(-integral_0^t sum_j lambda_j(s) ds)",
        "F_i(T)=integral_0^T S(t) lambda_i(t) dt",
        "S(T)+sum_i F_i(T)=1"
      ],
      "inputs": [
        "cause-specific nonnegative hazard functions lambda_i(t)",
        "a finite horizon T",
        "an at-risk state ending at the first classified event"
      ],
      "valid_outputs": [
        "no-event probability through T",
        "cause-specific first-arrival probability through T"
      ],
      "assumptions": [
        "hazards, the at-risk state, and an exhaustive set of classified exits are defined for the declared system",
        "event labels and observation rules are declared",
        "the integrals exist on the horizon"
      ],
      "identifiability_limit": "The equations map hazards to event probabilities; they do not recover unique hazards from one non-observation or from unlabeled aggregate outcomes.",
      "ritonavir_status": "illustrative-only-not-fitted"
    },
    {
      "id": "constant-two-path-race",
      "register": "MATHEMATICAL_DERIVATION",
      "equations": [
        "Lambda=lambda_A+lambda_B",
        "P(no event by T)=exp(-Lambda T)",
        "P(A first by T)=(lambda_A/Lambda)(1-exp(-Lambda T))",
        "P(B first by T)=(lambda_B/Lambda)(1-exp(-Lambda T))",
        "P(A first | an event by T)=lambda_A/Lambda when T>0 and Lambda>0; otherwise undefined"
      ],
      "inputs": [
        "constant nonnegative rates lambda_A and lambda_B in one declared reciprocal-time unit",
        "a nonnegative horizon T in the matching time unit"
      ],
      "valid_outputs": [
        "a normalized three-outcome probability partition",
        "the conditional identity of the first path when T and the total rate are positive"
      ],
      "assumptions": [
        "constant cause-specific hazards while the system remains at risk",
        "no simultaneous classified first events",
        "perfect classification of the first event"
      ],
      "identifiability_limit": "A convenient race is not evidence that physical nucleation is stationary, independent, or fully detected.",
      "ritonavir_status": "illustrative-only-not-fitted"
    },
    {
      "id": "zero-winner-binomial-bound",
      "register": "MATHEMATICAL_DERIVATION",
      "equations": [
        "P(zero target winners in n independent batches | p)=(1-p)^n",
        "p_upper=1-(1-confidence)^(1/n)"
      ],
      "inputs": [
        "zero target-path winners among n positive independent comparable batches",
        "a one-sided confidence strictly between zero and one"
      ],
      "valid_outputs": [
        "a one-sided upper bound on the batch-level target-win probability"
      ],
      "assumptions": [
        "batches are independent and share a declared target-win probability",
        "winner type is completely detected and classified"
      ],
      "identifiability_limit": "This bounds a finite-horizon winner probability, not a microscopic target nucleation rate or the counterfactual target time after removing a competitor.",
      "ritonavir_status": "illustrative-only-not-fitted"
    },
    {
      "id": "zero-event-upper-bound",
      "register": "MATHEMATICAL_DERIVATION",
      "equations": [
        "P(N=0 | lambda,H)=exp(-lambda H)",
        "lambda_upper=-ln(1-confidence)/H"
      ],
      "inputs": [
        "zero observed target events",
        "positive total at-risk exposure H",
        "a one-sided confidence strictly between zero and one"
      ],
      "valid_outputs": [
        "a one-sided upper rate bound under the stated homogeneous Poisson observation model"
      ],
      "assumptions": [
        "exposure is fixed or target-independent and correctly accumulated only while target events remain observable and at risk",
        "the target event is perfectly detected and classified",
        "a constant rate is meaningful across the pooled exposure"
      ],
      "identifiability_limit": "The bound does not prove a zero rate, explain a mechanism, or survive unmodeled detection failure, history dependence, or informative censoring.",
      "ritonavir_status": "illustrative-only-not-fitted"
    },
    {
      "id": "robust-restoration-design",
      "register": "DESIGN_PROPOSAL",
      "equations": [
        "minimize d(x,x0) subject to inf_theta_in_Theta F_target(T|x,theta)>=q and declared safety, quality, rights, and authority constraints"
      ],
      "inputs": [
        "a declared meaning of minimum change d",
        "an empirically calibrated uncertainty and history set Theta",
        "a finite target horizon and probability",
        "separate safety, quality, rights, cost, and authority constraints"
      ],
      "valid_outputs": [
        "a robust model-dependent design candidate or an honest infeasibility result"
      ],
      "assumptions": [
        "the uncertainty set covers the declared live explanations",
        "the optimization variables are separately established as feasible and authorized"
      ],
      "identifiability_limit": "If the uncertainty set permits zero target hazard or an unbounded competitor, restoration may be infeasible; the constructive result is then a discriminating observation, not a forced prescription.",
      "ritonavir_status": "illustrative-only-not-fitted"
    },
    {
      "id": "minimum-target-rate",
      "register": "DESIGN_PROPOSAL",
      "equations": [
        "find the smallest lambda_A such that P(A first by T)>=q while lambda_B and T are held fixed"
      ],
      "inputs": [
        "a fixed abstract competitor rate lambda_B",
        "a positive horizon T",
        "a target probability q strictly between zero and one"
      ],
      "valid_outputs": [
        "an abstract numerical threshold for the constant two-path model"
      ],
      "assumptions": [
        "the constant two-path race is the chosen design abstraction",
        "the target is mathematically feasible as lambda_A grows"
      ],
      "identifiability_limit": "The threshold does not say which solvent, temperature, seed, process, or intervention could produce that rate, nor whether any intervention is safe or authorized.",
      "ritonavir_status": "illustrative-only-not-fitted"
    },
    {
      "id": "expected-information-design",
      "register": "DESIGN_PROPOSAL",
      "equations": [
        "d*=argmax_d E_y[KL(p(theta|y,d) || p(theta))]"
      ],
      "inputs": [
        "a declared prior over competing explanations",
        "candidate observation designs and likelihoods",
        "declared cost, safety, rights, and stopping constraints"
      ],
      "valid_outputs": [
        "a ranked set of model-dependent information opportunities, not a command"
      ],
      "assumptions": [
        "the prior and likelihood are explicit enough to challenge",
        "information value is not treated as the only value"
      ],
      "identifiability_limit": "Expected information gain can optimize inside a model while the model, purpose, cost, or authority remains wrong.",
      "ritonavir_status": "illustrative-only-not-fitted"
    }
  ],
  "worked_examples": [
    {
      "id": "slow-path-against-fast-path",
      "model_id": "constant-two-path-race",
      "hypothetical": true,
      "inputs": {
        "lambda_A": 0.02,
        "lambda_B": 0.18,